{
  "$schema": "http://json-schema.org/draft-04/schema#",
  "type": "object",
  "additionalProperties": false,
  "properties": {
    "$schema": {
      "type": "string"
    },
    "globals": {
      "type": "object",
      "properties": {
        "dataImage": {
          "type": "string"
        },
        "appServerTsImage": {
          "type": "string"
        },
        "webAppImage": {
          "type": "string"
        }
      },
      "patternProperties": {
        "^.*$": {
          "type": "string"
        }
      }
    },
    "networks": {
      "anyOf": [
        {
          "type": "array",
          "items": {
            "type": "string"
          }
        },
        {
          "type": "object",
          "patternProperties": {
            "^.*$": {
              "anyOf": [
                {
                  "type": "null"
                },
                {
                  "type": "object",
                  "additionalProperties": false,
                  "properties": {
                    "driver": {
                      "type": "string"
                    },
                    "driver_opts": {
                      "type": "object"
                    },
                    "external": {
                      "type": "boolean"
                    }
                  }
                }
              ]
            }
          }
        }
      ]
    },
    "volumes": {
      "type": "array",
      "items": {
        "type": "string"
      }
    },
    "services": {
      "type": "object",
      "patternProperties": {
        "^.*$": {
          "type": "object",
          "additionalProperties": false,
          "properties": {
            "image": {
              "type": "string"
            },
            "build": {
              "type": "object",
              "additionalProperties": false,
              "properties": {
                "context": {
                  "type": "string"
                },
                "dockerfile": {
                  "type": "string"
                }
              }
            },
            "init": {
              "type": "boolean"
            },
            "working_dir": {
              "type": "string"
            },
            "restart": {
              "type": "string",
              "enum": [
                "no",
                "always",
                "unless-stopped"
              ]
            },
            "healthcheck": {
              "type": "object",
              "properties": {
                "test": {
                  "type": "array",
                  "items": {
                    "type": "string"
                  }
                }
              }
            },
            "scale": {
              "type": "string"
            },
            "ports": {
              "type": "object",
              "patternProperties": {
                "^.*$": {
                  "type": "string"
                }
              }
            },
            "ulimits": {
              "type": "object",
              "properties": {
                "nofile": {
                  "type": "object",
                  "properties": {
                    "soft": {
                      "type": "number"
                    },
                    "hard": {
                      "type": "number"
                    }
                  }
                }
              }
            },
            "deploy": {
              "type": "object",
              "resources": {
                "type": "object",
                "limits": {
                  "type": "object",
                  "cpus": {
                    "type": "string"
                  },
                  "memory": {
                    "type": "string"
                  }
                },
                "reservations": {
                  "type": "object",
                  "cpus": {
                    "type": "string"
                  },
                  "memory": {
                    "type": "string"
                  }
                }
              }
            },
            "environment": {
              "type": "object",
              "additionalProperties": false,
              "patternProperties": {
                "^.*$": {
                  "anyOf": [
                    {
                      "type": "string"
                    },
                    {
                      "type": "array",
                      "items": {
                        "type": "string"
                      }
                    }
                  ]
                }
              }
            },
            "labels": {
              "type": "object",
              "additionalProperties": false,
              "patternProperties": {
                "^.*$": {
                  "anyOf": [
                    {
                      "type": "string"
                    }
                  ]
                }
              }
            },
            "volumes": {
              "type": "object",
              "additionalProperties": false,
              "patternProperties": {
                "^.*$": {
                  "anyOf": [
                    {
                      "type": "null"
                    },
                    {
                      "type": "string"
                    }
                  ]
                }
              }
            },
            "depends_on": {
              "anyOf": [
                {
                  "type": "array",
                  "items": {
                    "type": "string"
                  }
                },
                {
                  "type": "object",
                  "patternProperties": {
                    "^.*$": {
                      "additionalProperties": false,
                      "properties": {
                        "condition": {
                          "type": "string"
                        }
                      }
                    }
                  }
                }
              ]
            },
            "networks": {
              "anyOf": [
                {
                  "type": "object",
                  "patternProperties": {
                    "^.*$": {
                      "type": "null"
                    }
                  }
                },
                {
                  "type": "array",
                  "items": {
                    "type": "string"
                  }
                }
              ]
            },
            "command": {
              "anyOf": [
                {
                  "type": "string"
                },
                {
                  "type": "array",
                  "items": {
                    "type": "string"
                  }
                }
              ]
            },
            "entrypoint": {
              "anyOf": [
                {
                  "type": "string"
                },
                {
                  "type": "array",
                  "items": {
                    "type": "string"
                  }
                }
              ]
            },
            "stop_grace_period": {
              "type": "string"
            }
          }
        }
      }
    }
  }
}